{
  "contract_version": "0.3.0",
  "query_id": "q_20260929T094500Z_a10001",
  "site_id": "teesta",
  "status": "complete",
  "method": "gp_emulator",
  "mode": "scenario",
  "resolved_inputs": {
    "water_volume_m3": {"value": 10000000.0, "low": null, "high": null, "unit": "m3", "interval": "none", "kind": "input", "confidence": null, "basis": "illustrative (fixed at range midpoint, not an Azmi output)"},
    "breach_width_m": {"value": 75.0, "low": null, "high": null, "unit": "m", "interval": "none", "kind": "input", "confidence": null, "basis": "illustrative Azmi-pair low member"},
    "failure_time_s": {"value": 1200.0, "low": null, "high": null, "unit": "s", "interval": "none", "kind": "input", "confidence": null, "basis": "illustrative Azmi-pair low member"}
  },
  "summary": {
    "inundated_area_m2": {"value": 1761600.0, "low": null, "high": null, "unit": "m2", "interval": "none", "kind": "predicted", "confidence": "MODERATE", "basis": "illustrative"},
    "max_depth_m": {"value": 0.404, "low": null, "high": null, "unit": "m", "interval": "none", "kind": "predicted", "confidence": "MODERATE", "basis": "illustrative"},
    "max_velocity_ms": {"value": 1.017, "low": null, "high": null, "unit": "m/s", "interval": "none", "kind": "predicted", "confidence": "MODERATE", "basis": "illustrative"},
    "peak_discharge_m3s": {"value": 440.5, "low": null, "high": null, "unit": "m3/s", "interval": "none", "kind": "predicted", "confidence": "MODERATE", "basis": "illustrative"},
    "first_arrival": {"poi_id": "teesta__poi__mangan_district_hospital", "name": "Mangan district hospital", "arrival_s": {"value": 30476.9, "low": null, "high": null, "unit": "s", "interval": "none", "kind": "predicted", "confidence": "MODERATE", "basis": "illustrative"}}
  },
  "confidence": {
    "overall": {"level": "MODERATE", "components": {"validation_skill": "GOOD", "query_coverage": "INSIDE", "spread": "NARROW"}, "reason_key": "Capped at MODERATE — placeholder inputs (south_lhonak breach_location, dam_height_m are status: placeholder)."},
    "extent": {"level": "MODERATE", "components": {"validation_skill": "GOOD", "query_coverage": "INSIDE", "spread": "NARROW"}, "reason_key": "Capped at MODERATE — placeholder inputs."},
    "depth": {"level": "MODERATE", "components": {"validation_skill": "GOOD", "query_coverage": "INSIDE", "spread": "NARROW"}, "reason_key": "Capped at MODERATE — placeholder inputs."},
    "arrival": {"level": "MODERATE", "components": {"validation_skill": "GOOD", "query_coverage": "INSIDE", "spread": "NARROW"}, "reason_key": "Capped at MODERATE — placeholder inputs."},
    "velocity": {"level": "MODERATE", "components": {"validation_skill": "GOOD", "query_coverage": "INSIDE", "spread": "NARROW"}, "reason_key": "Capped at MODERATE — placeholder inputs."}
  },
  "layers": [
    {"layer_id": "depth_p50", "type": "raster_png", "url": "/preview/far_depth_azmi_low.png", "bounds_latlng": [[27.5, 88.0], [28.2, 89.0]], "style_id": "depth_p50", "unit": "m", "available": true},
    {"layer_id": "extent_class", "type": "raster_png", "url": "/preview/far_zone_scenario.png", "bounds_latlng": [[27.5, 88.0], [28.2, 89.0]], "style_id": "extent_class", "unit": null, "available": true}
  ],
  "vectors": {"extent_url": "/preview/extent_placeholder.geojson"},
  "flags": {"outside_trained_range": false, "demo_mode": false, "library_outdated": false, "has_placeholders": true},
  "placeholder_fields": ["dams.teesta__south_lhonak.key_specs.dam_height_m", "dams.teesta__south_lhonak.key_specs.breach_location"],
  "caveats": [
    {"id": "placeholder_data", "severity": "warning", "text_key": "placeholder_data"},
    {"id": "moraine_extrapolation", "severity": "warning", "text_key": "moraine_extrapolation"},
    {"id": "scenario_no_probabilities", "severity": "info", "text_key": "scenario_no_probabilities"},
    {"id": "skill_illustrative_not_emulator_estimate", "severity": "info", "text_key": "skill_illustrative_not_emulator_estimate"},
    {"id": "preview_illustrative", "severity": "critical", "text_key": "preview_illustrative"}
  ],
  "provenance": {
    "method": "gp_emulator", "contract_version": "0.3.0",
    "code_version": "preview", "run_ids": [],
    "source": "fixture:preview",
    "note": "One of two Azmi-pair scenario members (the 'low'/lower-footprint one, by computed inundated area -- see frontend/src/data/preview/generated/teesta_confidence.json 'scenario_zone_basis'). water_volume_m3 is a fixed illustrative point value (not an Azmi output); breach_width_m/failure_time_s are the illustrative low-member point, INSIDE the training box (query_coverage=INSIDE), which is why this member's own weakest-link check computes HIGH before the placeholder cap. Every summary and confidence value is computed by gen_preview_assets.py:gen_confidence_ensemble() from a deterministic profile formula and a 30-point illustrative training design read from this site's own emulator_inputs ranges -- none is hand-typed. Confidence is capped at MODERATE because Teesta's site config still has placeholder inputs (CLAUDE.md rule 3 / m5_specs.md SS6)."
  },
  "timing_ms": {"median_phase": 0, "full_phase": 0}
}
