{
  "contract_version": "0.3.0",
  "query_id": "q_20260929T094500Z_a10002",
  "site_id": "teesta",
  "status": "complete",
  "method": "gp_emulator",
  "mode": "scenario",
  "resolved_inputs": {
    "water_volume_m3": {"value": 10000000.0, "low": null, "high": null, "unit": "m3", "interval": "none", "kind": "input", "confidence": null, "basis": "illustrative (fixed at range midpoint, not an Azmi output)"},
    "breach_width_m": {"value": 165.0, "low": null, "high": null, "unit": "m", "interval": "none", "kind": "input", "confidence": null, "basis": "illustrative Azmi-pair high member"},
    "failure_time_s": {"value": 9000.0, "low": null, "high": null, "unit": "s", "interval": "none", "kind": "input", "confidence": null, "basis": "illustrative Azmi-pair high member"}
  },
  "summary": {
    "inundated_area_m2": {"value": 2620800.0, "low": null, "high": null, "unit": "m2", "interval": "none", "kind": "predicted", "confidence": "MODERATE", "basis": "illustrative"},
    "max_depth_m": {"value": 0.362, "low": null, "high": null, "unit": "m", "interval": "none", "kind": "predicted", "confidence": "MODERATE", "basis": "illustrative"},
    "max_velocity_ms": {"value": 0.963, "low": null, "high": null, "unit": "m/s", "interval": "none", "kind": "predicted", "confidence": "MODERATE", "basis": "illustrative"},
    "peak_discharge_m3s": {"value": 585.4, "low": null, "high": null, "unit": "m3/s", "interval": "none", "kind": "predicted", "confidence": "MODERATE", "basis": "illustrative"},
    "first_arrival": {"poi_id": "teesta__poi__mangan_district_hospital", "name": "Mangan district hospital", "arrival_s": {"value": 32192.0, "low": null, "high": null, "unit": "s", "interval": "none", "kind": "predicted", "confidence": "MODERATE", "basis": "illustrative"}}
  },
  "confidence": {
    "overall": {"level": "MODERATE", "components": {"validation_skill": "GOOD", "query_coverage": "INSIDE", "spread": "NARROW"}, "reason_key": "Capped at MODERATE — placeholder inputs (south_lhonak breach_location, dam_height_m are status: placeholder)."},
    "extent": {"level": "MODERATE", "components": {"validation_skill": "GOOD", "query_coverage": "INSIDE", "spread": "NARROW"}, "reason_key": "Capped at MODERATE — placeholder inputs."},
    "depth": {"level": "MODERATE", "components": {"validation_skill": "GOOD", "query_coverage": "INSIDE", "spread": "NARROW"}, "reason_key": "Capped at MODERATE — placeholder inputs."},
    "arrival": {"level": "MODERATE", "components": {"validation_skill": "GOOD", "query_coverage": "INSIDE", "spread": "NARROW"}, "reason_key": "Capped at MODERATE — placeholder inputs."},
    "velocity": {"level": "MODERATE", "components": {"validation_skill": "GOOD", "query_coverage": "INSIDE", "spread": "NARROW"}, "reason_key": "Capped at MODERATE — placeholder inputs."}
  },
  "layers": [
    {"layer_id": "depth_p50", "type": "raster_png", "url": "/preview/far_depth_azmi_high.png", "bounds_latlng": [[27.5, 88.0], [28.2, 89.0]], "style_id": "depth_p50", "unit": "m", "available": true},
    {"layer_id": "extent_class", "type": "raster_png", "url": "/preview/far_zone_scenario.png", "bounds_latlng": [[27.5, 88.0], [28.2, 89.0]], "style_id": "extent_class", "unit": null, "available": true}
  ],
  "vectors": {"extent_url": "/preview/extent_placeholder.geojson"},
  "flags": {"outside_trained_range": false, "demo_mode": false, "library_outdated": false, "has_placeholders": true},
  "placeholder_fields": ["dams.teesta__south_lhonak.key_specs.dam_height_m", "dams.teesta__south_lhonak.key_specs.breach_location"],
  "caveats": [
    {"id": "placeholder_data", "severity": "warning", "text_key": "placeholder_data"},
    {"id": "moraine_extrapolation", "severity": "warning", "text_key": "moraine_extrapolation"},
    {"id": "scenario_no_probabilities", "severity": "info", "text_key": "scenario_no_probabilities"},
    {"id": "preview_illustrative", "severity": "critical", "text_key": "preview_illustrative"}
  ],
  "provenance": {
    "method": "gp_emulator", "contract_version": "0.3.0",
    "code_version": "preview", "run_ids": [],
    "source": "fixture:preview",
    "note": "The other Azmi-pair scenario member (the 'high'/larger-footprint one, by computed inundated area -- see frontend/src/data/preview/generated/teesta_confidence.json 'scenario_zone_basis'). Shares the same extent_class raster (far_zone_scenario.png) as the low member: cells wet under the low member are HIGH, cells wet under this high member but not the low one are POSSIBLE, per docs/impact_outputs.md's scenario-mode zone rule. Every summary and confidence value is computed by gen_preview_assets.py:gen_confidence_ensemble() -- none is hand-typed. Confidence is capped at MODERATE because Teesta's site config still has placeholder inputs."
  },
  "timing_ms": {"median_phase": 0, "full_phase": 0}
}
