{
  "contract_version": "0.3.0",
  "query_id": "q_20260929T094500Z_a6demo1",
  "site_id": "teesta",
  "status": "complete",
  "method": "gp_emulator",
  "mode": "scenario",
  "resolved_inputs": {
    "water_volume_m3": {"value": 16500000.0, "low": null, "high": null, "unit": "m3", "interval": "none", "kind": "input", "confidence": null, "basis": "illustrative: training box high (15,000,000) x 1.10 -- deliberately 10% beyond the trained edge, per acceptance test A6 (m5_specs.md §7)"},
    "breach_width_m": {"value": 75.0, "low": null, "high": null, "unit": "m", "interval": "none", "kind": "input", "confidence": null, "basis": "illustrative, same as the Azmi-low member (in range)"},
    "failure_time_s": {"value": 1200.0, "low": null, "high": null, "unit": "s", "interval": "none", "kind": "input", "confidence": null, "basis": "illustrative, same as the Azmi-low member (in range)"}
  },
  "summary": {
    "inundated_area_m2": {"value": 1891200.0, "low": null, "high": null, "unit": "m2", "interval": "none", "kind": "predicted", "confidence": "LOW", "basis": "illustrative"},
    "max_depth_m": {"value": 0.478, "low": null, "high": null, "unit": "m", "interval": "none", "kind": "predicted", "confidence": "LOW", "basis": "illustrative"},
    "max_velocity_ms": {"value": 1.106, "low": null, "high": null, "unit": "m/s", "interval": "none", "kind": "predicted", "confidence": "LOW", "basis": "illustrative"},
    "peak_discharge_m3s": {"value": 565.8, "low": null, "high": null, "unit": "m3/s", "interval": "none", "kind": "predicted", "confidence": "LOW", "basis": "illustrative"},
    "first_arrival": {"poi_id": "teesta__poi__mangan_district_hospital", "name": "Mangan district hospital", "arrival_s": {"value": 28036.5, "low": null, "high": null, "unit": "s", "interval": "none", "kind": "predicted", "confidence": "LOW", "basis": "illustrative"}}
  },
  "confidence": {
    "overall": {"level": "LOW", "components": {"validation_skill": "GOOD", "query_coverage": "OUTSIDE", "spread": "NARROW"}, "reason_key": "Low (C: query outside trained V_w range)"},
    "extent": {"level": "LOW", "components": {"validation_skill": "GOOD", "query_coverage": "OUTSIDE", "spread": "NARROW"}, "reason_key": "Low (C: query outside trained V_w range)"},
    "depth": {"level": "LOW", "components": {"validation_skill": "GOOD", "query_coverage": "OUTSIDE", "spread": "NARROW"}, "reason_key": "Low (C: query outside trained V_w range)"},
    "arrival": {"level": "LOW", "components": {"validation_skill": "GOOD", "query_coverage": "OUTSIDE", "spread": "NARROW"}, "reason_key": "Low (C: query outside trained V_w range)"},
    "velocity": {"level": "LOW", "components": {"validation_skill": "GOOD", "query_coverage": "OUTSIDE", "spread": "NARROW"}, "reason_key": "Low (C: query outside trained V_w range)"}
  },
  "layers": [],
  "vectors": {"extent_url": "/preview/extent_placeholder.geojson"},
  "flags": {"outside_trained_range": true, "demo_mode": false, "library_outdated": false, "has_placeholders": true},
  "placeholder_fields": ["dams.teesta__south_lhonak.key_specs.dam_height_m", "dams.teesta__south_lhonak.key_specs.breach_location"],
  "caveats": [
    {"id": "outside_trained_range", "severity": "warning", "text_key": "outOfRange"},
    {"id": "outside_trained_range_example", "severity": "info", "text_key": "outside_trained_range_example"},
    {"id": "placeholder_data", "severity": "warning", "text_key": "placeholder_data"},
    {"id": "moraine_extrapolation", "severity": "warning", "text_key": "moraine_extrapolation"},
    {"id": "scenario_no_probabilities", "severity": "info", "text_key": "scenario_no_probabilities"},
    {"id": "skill_illustrative_not_emulator_estimate", "severity": "info", "text_key": "skill_illustrative_not_emulator_estimate"},
    {"id": "preview_illustrative", "severity": "critical", "text_key": "preview_illustrative"}
  ],
  "provenance": {
    "method": "gp_emulator", "contract_version": "0.3.0",
    "code_version": "preview", "run_ids": [],
    "source": "fixture:preview",
    "note": "Deliberate acceptance-test A6 demonstration (m5_specs.md §7: 'queries 10% outside the training box are labelled confidence C = Low'), not a normal scenario query. water_volume_m3 is set to the trained design box's high edge (15,000,000 m3) x 1.10 = 16,500,000 m3, 10% beyond the trained V_w range; breach_width_m/failure_time_s are held at the in-range Azmi-low values so V_w is the only out-of-range input, matching m5_specs.md §6's own quoted reason-text example exactly: 'Low (C: query outside trained V_w range)'. Computed by gen_preview_assets.py:gen_confidence_ensemble() -- see frontend/src/data/preview/generated/teesta_confidence.json 'outside_range_example'. Confidence is LOW purely from coverage; the placeholder-inputs cap (which would only force a ceiling of MODERATE) is not the reason here and does not apply on top of an already-lower LOW."
  },
  "timing_ms": {"median_phase": 0, "full_phase": 0}
}
