{
  "contract_version": "0.3.0",
  "query_id": "q_20260929T093000Z_9f3ab2",
  "site_id": "teesta",
  "status": "complete",
  "method": "sph_direct",
  "mode": "scenario",
  "resolved_inputs": {
    "breach_width_m": {"value": 120.0, "low": 120.0, "high": 120.0, "unit": "m", "interval": "none", "kind": "input", "confidence": null, "basis": "illustrative"},
    "failure_time_s": {"value": 3600.0, "low": 3600.0, "high": 3600.0, "unit": "s", "interval": "none", "kind": "input", "confidence": null, "basis": "illustrative"}
  },
  "summary": {
    "inundated_area_m2": {"value": 253350.0, "low": null, "high": null, "unit": "m2", "interval": "none", "kind": "predicted", "confidence": "LOW", "basis": "illustrative"},
    "max_depth_m": {"value": 3.474, "low": null, "high": null, "unit": "m", "interval": "none", "kind": "predicted", "confidence": "LOW", "basis": "illustrative"},
    "max_velocity_ms": {"value": 3.728, "low": null, "high": null, "unit": "m/s", "interval": "none", "kind": "predicted", "confidence": "LOW", "basis": "illustrative"},
    "peak_discharge_m3s": {"value": 2100.0, "low": null, "high": null, "unit": "m3/s", "interval": "none", "kind": "predicted", "confidence": "LOW", "basis": "illustrative"},
    "first_arrival": {"poi_id": "teesta__nf__section_nf1", "name": "Near-field section NF-1 (illustrative)", "arrival_s": {"value": 373.4, "low": null, "high": null, "unit": "s", "interval": "none", "kind": "predicted", "confidence": "LOW", "basis": "illustrative"}}
  },
  "confidence": {
    "overall": {"level": "LOW", "components": {}, "reason_key": "conf_direct_solver_output"},
    "extent": {"level": "LOW", "components": {}, "reason_key": "conf_direct_solver_output"},
    "depth": {"level": "LOW", "components": {}, "reason_key": "conf_direct_solver_output"},
    "arrival": {"level": "LOW", "components": {}, "reason_key": "conf_direct_solver_output"},
    "velocity": {"level": "LOW", "components": {}, "reason_key": "conf_direct_solver_output"}
  },
  "layers": [
    {"layer_id": "depth_p50", "type": "raster_png", "url": "/preview/nf1_sph_depth_p50.png", "bounds_latlng": [[27.80, 88.60], [27.87, 88.68]], "style_id": "depth_p50", "unit": "m", "available": true}
  ],
  "vectors": {"extent_url": "/preview/extent_placeholder.geojson"},
  "flags": {"outside_trained_range": false, "demo_mode": false, "library_outdated": false, "has_placeholders": false},
  "placeholder_fields": [],
  "caveats": [
    {"id": "direct_solver_output", "severity": "warning", "text_key": "direct_solver_output"},
    {"id": "clear_water", "severity": "warning", "text_key": "clear_water"},
    {"id": "nearfield_arrival_from_section_inflow", "severity": "info", "text_key": "nearfield_arrival_from_section_inflow"},
    {"id": "preview_illustrative", "severity": "critical", "text_key": "preview_illustrative"}
  ],
  "provenance": {
    "method": "sph_direct", "contract_version": "0.3.0",
    "code_version": "preview", "solver_versions": {"dualsphysics": "5.4.355"},
    "run_ids": ["teesta__nf1_preview__sph"],
    "scenario_id": "teesta__nf1_preview",
    "source": "fixture:preview",
    "note": "Illustrative near-field SPH result for a short reach (near-field section NF-1) fed by a routed D-Flow FM discharge series, per the M3->M4 routed-discharge design (docs/decisions.md 2026-09-27). It does not report a value at Chungthang or any other named POI -- M4 near-field domains are short sections, not the full far-field reach. Summary values are computed by frontend/scripts/gen_preview_assets.py:gen_nearfield_pair() from a generated depth/velocity grid, not typed by hand; see frontend/src/data/preview/generated/nf1_comparison.json. The real Teesta SPH attempt (a02) is flagged anomalous and not shown (see ui_text.json onboarding.noPairedSph); this fixture shows the target state once workstream 4 (a real DualSPHysics site run) lands, not that attempt's numbers."
  },
  "timing_ms": {"median_phase": 0, "full_phase": 0}
}
